{
  "id": "holdout_qa_2026_02_10_214446",
  "source_type": "url",
  "normalized_lines": [
    "Easy 1-Pot Tikka Masala",
    "Ingredients",
    "3 Tbsp avocado oil (or sub ghee if not vegan)",
    "1 medium white or yellow onion, finely diced",
    "1 Tbsp ground cumin",
    "1 tsp sea salt (DIVIDED // plus more to taste)",
    "6 cloves garlic, minced (6 cloves yield ~3 Tbsp)",
    "2 Tbsp fresh minced ginger",
    "1 medium red bell pepper, seeds and stems removed, halved then sliced lengthwise",
    "1 \u00bd Tbsp minced green chili, stems and seeds removed (use serrano or jalape\u00f1o)",
    "1 boneless skinless chicken breast, cubed",
    "1 Tbsp ground coriander",
    "1/4 tsp red chili flake (omit for less heat)",
    "1 tsp ground turmeric",
    "1 tsp smoked paprika",
    "2 15-ounce cans diced tomatoes (if unsalted, you\u2019ll add more salt to the dish) BLEND ONE CAN FOR SMOOTHER TEXTURE",
    "1 15-ounce can chickpeas, slightly drained (if omitting chicken, double quantity of chickpeas)",
    "1 Tbsp garam masala* (see notes for DIY blend)",
    "1-2 Tbsp coconut sugar",
    "1 14-ounce can full-fat coconut milk (sub light coconut milk for less fat)",
    "White or brown rice",
    "Fresh cilantro, chopped",
    "Fresh jalape\u00f1o (omit for less heat)",
    "Instructions",
    "Heat a large pot or Dutch oven over medium heat. Once hot, add oil, onion, cumin, and one-third of the salt (1/3 tsp as original recipe is written // adjust if altering batch size). Saut\u00e9 for 2-3 minutes.",
    "Add garlic, ginger, bell pepper, and green chili and stir. Saut\u00e9 for 2-3 minutes.",
    "Next add chicken breast (or omit if not adding \u2014 you\u2019ll double up on chickpeas later), ground coriander, chili flake, turmeric, and paprika and stir to coat. Add another one-third of the salt (1/3 tsp as original recipe is written // adjust if altering batch size). Saut\u00e9 for 3 minutes, stirring frequently.",
    "Next add diced tomatoes (optional: pur\u00e9e one of the cans of tomatoes in a small blender before adding for a creamier sauce). Then add chickpeas, garam masala, coconut sugar, and remaining salt (1/3 tsp as original recipe is written // adjust if altering batch size).",
    "Increase heat to medium high until it reaches a rolling simmer, then reduce heat to low or medium-low and maintain a simmer (uncovered) for 15-20 minutes or until thick and stew-like. Stir occasionally.",
    "Add coconut milk and stir to combine. Simmer for 5 minutes on medium-low heat. Then taste and adjust seasonings as needed, adding more salt to taste, chili flake (or a pinch of cayenne) for heat, coconut sugar for sweetness, cumin or paprika for smokiness, or garam masala for a more spiced / earthy flavor.",
    "Garnish with fresh cilantro and jalape\u00f1os for added heat (optional). Can be enjoyed as a stew, or with white or brown rice or cauliflower rice. Another favorite is serving over roasted sweet potatoes.",
    "Leftovers will keep covered in the refrigerator up to 4-5 days, or in the freezer up to 1 month."
  ],
  "target_recipe": {
    "title": "Easy 1-Pot Tikka Masala",
    "ingredients": [
      "3 Tbsp avocado oil (or sub ghee if not vegan)",
      "1 medium white or yellow onion, finely diced",
      "1 Tbsp ground cumin",
      "1 tsp sea salt (DIVIDED // plus more to taste)",
      "6 cloves garlic, minced (6 cloves yield ~3 Tbsp)",
      "2 Tbsp fresh minced ginger",
      "1 medium red bell pepper, seeds and stems removed, halved then sliced lengthwise",
      "1 \u00bd Tbsp minced green chili, stems and seeds removed (use serrano or jalape\u00f1o)",
      "1 boneless skinless chicken breast, cubed",
      "1 Tbsp ground coriander",
      "1/4 tsp red chili flake (omit for less heat)",
      "1 tsp ground turmeric",
      "1 tsp smoked paprika",
      "2 15-ounce cans diced tomatoes (if unsalted, you\u2019ll add more salt to the dish) BLEND ONE CAN FOR SMOOTHER TEXTURE",
      "1 15-ounce can chickpeas, slightly drained (if omitting chicken, double quantity of chickpeas)",
      "1 Tbsp garam masala* (see notes for DIY blend)",
      "1-2 Tbsp coconut sugar",
      "1 14-ounce can full-fat coconut milk (sub light coconut milk for less fat)",
      "White or brown rice",
      "Fresh cilantro, chopped",
      "Fresh jalape\u00f1o (omit for less heat)"
    ],
    "steps": [
      "Heat a large pot or Dutch oven over medium heat. Once hot, add oil, onion, cumin, and one-third of the salt (1/3 tsp as original recipe is written // adjust if altering batch size). Saut\u00e9 for 2-3 minutes.",
      "Add garlic, ginger, bell pepper, and green chili and stir. Saut\u00e9 for 2-3 minutes.",
      "Next add chicken breast (or omit if not adding \u2014 you\u2019ll double up on chickpeas later), ground coriander, chili flake, turmeric, and paprika and stir to coat. Add another one-third of the salt (1/3 tsp as original recipe is written // adjust if altering batch size). Saut\u00e9 for 3 minutes, stirring frequently.",
      "Next add diced tomatoes (optional: pur\u00e9e one of the cans of tomatoes in a small blender before adding for a creamier sauce). Then add chickpeas, garam masala, coconut sugar, and remaining salt (1/3 tsp as original recipe is written // adjust if altering batch size).",
      "Increase heat to medium high until it reaches a rolling simmer, then reduce heat to low or medium-low and maintain a simmer (uncovered) for 15-20 minutes or until thick and stew-like. Stir occasionally.",
      "Add coconut milk and stir to combine. Simmer for 5 minutes on medium-low heat. Then taste and adjust seasonings as needed, adding more salt to taste, chili flake (or a pinch of cayenne) for heat, coconut sugar for sweetness, cumin or paprika for smokiness, or garam masala for a more spiced / earthy flavor.",
      "Garnish with fresh cilantro and jalape\u00f1os for added heat (optional). Can be enjoyed as a stew, or with white or brown rice or cauliflower rice. Another favorite is serving over roasted sweet potatoes.",
      "Leftovers will keep covered in the refrigerator up to 4-5 days, or in the freezer up to 1 month."
    ],
    "notes": []
  }
}
