{
  "id": "qa_2026_02_10_115942",
  "source_type": "url",
  "normalized_lines": [
    "Shakshuka Recipe (Easy & Traditional)",
    "Ingredients",
    "2 tablespoons olive oil",
    "1 medium onion (diced)",
    "1 red bell pepper (seeded and diced)",
    "4 garlic cloves (finely chopped)",
    "2 teaspoon paprika",
    "1 teaspoon cumin",
    "\u00bc teaspoon chili powder",
    "1 (28-ounce can) whole peeled tomatoes",
    "6 large eggs",
    "salt and pepper (to taste)",
    "1 small bunch fresh cilantro (chopped)",
    "1 small bunch fresh parsley (chopped)",
    "Instructions",
    "Heat olive oil in a large saut\u00e9 pan on medium heat. Add the chopped bell pepper and onion and cook for 5 minutes or until the onion becomes translucent.",
    "Add garlic and spices and cook an additional minute.",
    "Pour the can of tomatoes and juice into the pan and break down the tomatoes using a large spoon. Season with salt and pepper and bring the sauce to a simmer.",
    "Use your large spoon to make small wells in the sauce and crack the eggs into each well. Cook the eggs for 5 to 8 minutes, or until the eggs are done to your liking. You can also cover the pan with a lid to expedite the eggs cooking.",
    "Garnish with chopped cilantro and parsley before serving."
  ],
  "target_recipe": {
    "title": "Shakshuka Recipe (Easy & Traditional)",
    "ingredients": [
      "2 tablespoons olive oil",
      "1 medium onion (diced)",
      "1 red bell pepper (seeded and diced)",
      "4 garlic cloves (finely chopped)",
      "2 teaspoon paprika",
      "1 teaspoon cumin",
      "\u00bc teaspoon chili powder",
      "1 (28-ounce can) whole peeled tomatoes",
      "6 large eggs",
      "salt and pepper (to taste)",
      "1 small bunch fresh cilantro (chopped)",
      "1 small bunch fresh parsley (chopped)"
    ],
    "steps": [
      "Heat olive oil in a large saut\u00e9 pan on medium heat. Add the chopped bell pepper and onion and cook for 5 minutes or until the onion becomes translucent.",
      "Add garlic and spices and cook an additional minute.",
      "Pour the can of tomatoes and juice into the pan and break down the tomatoes using a large spoon. Season with salt and pepper and bring the sauce to a simmer.",
      "Use your large spoon to make small wells in the sauce and crack the eggs into each well. Cook the eggs for 5 to 8 minutes, or until the eggs are done to your liking. You can also cover the pan with a lid to expedite the eggs cooking.",
      "Garnish with chopped cilantro and parsley before serving."
    ],
    "notes": []
  }
}
