{
  "id": "qa_2026_02_10_205507",
  "source_type": "manual_edge",
  "normalized_lines": [
    "WEEKNIGHT TURKEY CHILI",
    "4.7/5 (89 ratings)",
    "PRINT | SAVE | SHARE",
    "INGREDIENTS",
    "1 lb ground turkey",
    "1 tbsp. olive oil",
    "1 onion, diced",
    "2 bell peppers, diced",
    "3 cloves garlic, minced",
    "1 can (28 oz) crushed tomatoes",
    "1 can (15 oz) kidney beans, drained",
    "1 can (15 oz) black beans, drained",
    "1 1/2 tsp chili powder",
    "1 tsp cumin",
    "1/2 tsp smoked paprika",
    "Salt + pepper to taste",
    "Cooked rice, for serving",
    "1) Heat oil in a large pot over medium heat.",
    "2) Add onion + peppers; cook 5 minutes.",
    "3) Add garlic; cook 30 seconds.",
    "4) Add turkey; break up and cook until no longer pink.",
    "5) Stir in tomatoes, beans, and spices.",
    "6) Simmer 20-25 min, stirring occasionally.",
    "7) Serve with rice.",
    "COOK TIME: 35-40 MINUTES",
    "SERVES: 4",
    "TIP - add 1 tsp cocoa powder for deeper flavor.",
    "This page may contain affiliate links.",
    "ADVERTISEMENT"
  ],
  "target_recipe": {
    "title": "WEEKNIGHT TURKEY CHILI",
    "ingredients": [
      "1 lb ground turkey",
      "1 tbsp. olive oil",
      "1 onion, diced",
      "2 bell peppers, diced",
      "3 cloves garlic, minced",
      "1 can (28 oz) crushed tomatoes",
      "1 can (15 oz) kidney beans, drained",
      "1 can (15 oz) black beans, drained",
      "1 1/2 tsp chili powder",
      "1 tsp cumin",
      "1/2 tsp smoked paprika",
      "Salt + pepper to taste",
      "Cooked rice, for serving"
    ],
    "steps": [
      "1) Heat oil in a large pot over medium heat.",
      "2) Add onion + peppers; cook 5 minutes.",
      "3) Add garlic; cook 30 seconds.",
      "4) Add turkey; break up and cook until no longer pink.",
      "5) Stir in tomatoes, beans, and spices.",
      "6) Simmer 20-25 min, stirring occasionally.",
      "7) Serve with rice."
    ],
    "notes": [
      "TIP - add 1 tsp cocoa powder for deeper flavor."
    ]
  }
}
