{
  "id": "qa_2026_02_10_163122",
  "source_type": "manual_edge",
  "normalized_lines": [
    "Ultimate Weeknight Sheet-Pan Dinner (Serves 4 to 6)",
    "Prep time: 20 mins",
    "Cook time: 35-40 minutes",
    "Total time: about 1 hour",
    "Yield: 1 large tray",
    "For the Chicken:",
    "1 1/2 lb boneless, skinless chicken thighs, cut into 1-inch pieces",
    "2 tbsp. olive oil",
    "1 tablespoon plus 1 tsp honey",
    "3 to 4 garlic cloves, finely grated",
    "1/2 tsp kosher salt",
    "1/4 to 1/2 tsp black pepper",
    "1 tsp smoked paprika",
    "For the Veg:",
    "1 large red onion, cut into wedges",
    "1 broccolini bunch (about 8 oz), trimmed",
    "8 to 8 1/2 oz cremini mushrooms, halved",
    "2 tbsp olive oil, divided",
    "Pinch of chili flakes (optional)",
    "For the Sauce:",
    "1/3 c. low-sodium soy sauce",
    "2 tbsp rice vinegar",
    "1 tbsp cornstarch",
    "1 tsp toasted sesame oil",
    "2 to 3 tbsp water, as needed",
    "To finish:",
    "Cooked rice, for serving",
    "2 scallions, thinly sliced",
    "Sesame seeds, for garnish",
    "1. Heat oven to 425\u00b0F. Line a sheet pan with parchment.",
    "2. In a large bowl, toss chicken with olive oil, honey, garlic, salt, pepper, and paprika. Let sit 10 minutes while you prep vegetables.",
    "3. In another bowl, toss onion, broccolini, and mushrooms with 1 tbsp olive oil, chili flakes, and a pinch of salt.",
    "4. Arrange chicken on one side of the tray and vegetables on the other side; roast 18 minutes.",
    "5. Meanwhile, whisk soy sauce, vinegar, cornstarch, sesame oil, and 2 tbsp water. If very thick, add 1 more tbsp water.",
    "6. Remove tray, toss chicken with sauce, and return to oven for 8 to 10 minutes, until glossy and cooked through.",
    "7. Taste vegetables; season with extra salt if needed.",
    "8. Serve over rice and top with scallions and sesame seeds.",
    "Note: If your pan is crowded, split between 2 trays so everything roasts instead of steams."
  ],
  "target_recipe": {
    "title": "Ultimate Weeknight Sheet-Pan Dinner (Serves 4 to 6)",
    "ingredients": [
      "1 1/2 lb boneless, skinless chicken thighs, cut into 1-inch pieces",
      "2 tbsp. olive oil",
      "1 tablespoon plus 1 tsp honey",
      "3 to 4 garlic cloves, finely grated",
      "1/2 tsp kosher salt",
      "1/4 to 1/2 tsp black pepper",
      "1 tsp smoked paprika",
      "1 large red onion, cut into wedges",
      "1 broccolini bunch (about 8 oz), trimmed",
      "8 to 8 1/2 oz cremini mushrooms, halved",
      "2 tbsp olive oil, divided",
      "Pinch of chili flakes (optional)",
      "1/3 c. low-sodium soy sauce",
      "2 tbsp rice vinegar",
      "1 tbsp cornstarch",
      "1 tsp toasted sesame oil",
      "2 to 3 tbsp water, as needed",
      "Cooked rice, for serving",
      "2 scallions, thinly sliced",
      "Sesame seeds, for garnish"
    ],
    "steps": [
      "1. Heat oven to 425\u00b0F. Line a sheet pan with parchment.",
      "2. In a large bowl, toss chicken with olive oil, honey, garlic, salt, pepper, and paprika. Let sit 10 minutes while you prep vegetables.",
      "3. In another bowl, toss onion, broccolini, and mushrooms with 1 tbsp olive oil, chili flakes, and a pinch of salt.",
      "4. Arrange chicken on one side of the tray and vegetables on the other side; roast 18 minutes.",
      "5. Meanwhile, whisk soy sauce, vinegar, cornstarch, sesame oil, and 2 tbsp water. If very thick, add 1 more tbsp water.",
      "6. Remove tray, toss chicken with sauce, and return to oven for 8 to 10 minutes, until glossy and cooked through.",
      "7. Taste vegetables; season with extra salt if needed.",
      "8. Serve over rice and top with scallions and sesame seeds."
    ],
    "notes": [
      "Note: If your pan is crowded, split between 2 trays so everything roasts instead of steams."
    ]
  }
}
