{
  "id": "qa_2026_02_10_162923",
  "source_type": "manual_edge",
  "normalized_lines": [
    "One-Pan Honey Garlic Chicken with Green Sauce",
    "Serves 4",
    "Total time: 45 minutes",
    "Ingredients",
    "For the chicken:",
    "1 lb. boneless, skinless chicken thighs, cut into 1/2-inch pieces",
    "3 to 4 garlic cloves, finely grated",
    "1 tbsp. neutral oil",
    "2 tbsp. honey",
    "1/3 c. reduced-sodium soy sauce",
    "1 to 1 1/2 tsp. kosher salt",
    "Freshly ground black pepper, to taste",
    "1 teapoon red chile flakes (optional)",
    "For the green sauce:",
    "1/2 cup plain Greek yogurt",
    "1 tbsp. tahini",
    "1 to 2 tbsp. lemon juice",
    "2 tbsp. chopped cilantro (plus more for serving)",
    "Water, as needed",
    "For serving:",
    "Cooked rice, for serving",
    "Toasted sesame seeds, for garnish",
    "Instructions",
    "1. Preheat oven to 425 F. Line a sheet pan with parchment.",
    "2. In a bowl, toss chicken with garlic, oil, salt, pepper, and chile flakes. Rest 10 minutes.",
    "3. Whisk honey and soy sauce; pour over chicken. Bake 12 to 15 minutes, then broil 2 minutes.",
    "4. Meanwhile, stir yogurt, tahini, lemon juice, cilantro, and enough water to loosen.",
    "5. Serve chicken over rice with sauce and sesame seeds.",
    "Notes",
    "- If using chicken breasts, reduce bake time by 2 to 3 minutes.",
    "- Sauce keeps 2 days in the fridge."
  ],
  "target_recipe": {
    "title": "One-Pan Honey Garlic Chicken with Green Sauce",
    "ingredients": [
      "1 lb. boneless, skinless chicken thighs, cut into 1/2-inch pieces",
      "3 to 4 garlic cloves, finely grated",
      "1 tbsp. neutral oil",
      "2 tbsp. honey",
      "1/3 c. reduced-sodium soy sauce",
      "1 to 1 1/2 tsp. kosher salt",
      "Freshly ground black pepper, to taste",
      "1 teapoon red chile flakes (optional)",
      "1/2 cup plain Greek yogurt",
      "1 tbsp. tahini",
      "1 to 2 tbsp. lemon juice",
      "2 tbsp. chopped cilantro (plus more for serving)",
      "Water, as needed",
      "Cooked rice, for serving",
      "Toasted sesame seeds, for garnish"
    ],
    "steps": [
      "1. Preheat oven to 425 F. Line a sheet pan with parchment.",
      "2. In a bowl, toss chicken with garlic, oil, salt, pepper, and chile flakes. Rest 10 minutes.",
      "3. Whisk honey and soy sauce; pour over chicken. Bake 12 to 15 minutes, then broil 2 minutes.",
      "4. Meanwhile, stir yogurt, tahini, lemon juice, cilantro, and enough water to loosen.",
      "5. Serve chicken over rice with sauce and sesame seeds."
    ],
    "notes": [
      "- If using chicken breasts, reduce bake time by 2 to 3 minutes.",
      "- Sauce keeps 2 days in the fridge."
    ]
  }
}
